{
  "schema": "rtl-advisor-plugin-abc-arm-result-v1",
  "experiment_id": "plugin-abc-v1",
  "arm": "A",
  "repetition": 2,
  "model": "gpt-5.6-sol",
  "reasoning_effort": "xhigh",
  "manifest_sha256": "9a66873f7cd820f2aa2e31a20d99d961e3aa80e8e735d9613a55bdb0e09f3dc2",
  "cases": [
    {
      "case_id": "g01",
      "source_sha256": "6d0567dc6d51a61a375d96afb0318456aed98864fe8b97ffb0ae739163389f68",
      "decision": "no_change",
      "scope_claim": "whole_case",
      "source_locations": ["experiments/plugin-abc-v1/cases/generated/g01_add8_left.sv:5"],
      "rationale": "Balancing the four-input modular add is formally equivalent, but the fixed Yosys/ABC recipe mapped baseline and candidate identically to 100 gates (38 AND, 18 OR, 44 XOR), so there is no measured PPA basis for a change.",
      "candidates": [
        {
          "candidate_id": "g01_candidate_1",
          "path": "experiments/plugin-abc-v1/runs/arm-a/r2/candidates/g01/candidate_1.sv",
          "formal_status": "formal_passed",
          "measurement_status": "measured",
          "final_state": "synthesis_handles",
          "evidence_paths": [
            "experiments/plugin-abc-v1/runs/arm-a/r2/evidence/g01_formal.log",
            "experiments/plugin-abc-v1/runs/arm-a/r2/evidence/g01_baseline_measure.log",
            "experiments/plugin-abc-v1/runs/arm-a/r2/evidence/g01_candidate_measure.log"
          ]
        }
      ],
      "evidence_complete": true,
      "limitations": ["The mapping recipe reports generic gate counts, not placed timing or power."]
    },
    {
      "case_id": "g02",
      "source_sha256": "6b6a194bed066969259d9b93a18469c0bba26a7d89ff2a803f820294289c854c",
      "decision": "no_change",
      "scope_claim": "whole_case",
      "source_locations": ["experiments/plugin-abc-v1/cases/generated/g02_add32_five.sv:5"],
      "rationale": "A depth-balanced five-input modular add passed formal equivalence, but baseline and candidate both mapped to 626 gates (243 AND, 132 OR, 251 XOR); the raw synthesis flow already removes the RTL grouping difference.",
      "candidates": [
        {
          "candidate_id": "g02_candidate_1",
          "path": "experiments/plugin-abc-v1/runs/arm-a/r2/candidates/g02/candidate_1.sv",
          "formal_status": "formal_passed",
          "measurement_status": "measured",
          "final_state": "synthesis_handles",
          "evidence_paths": [
            "experiments/plugin-abc-v1/runs/arm-a/r2/evidence/g02_formal.log",
            "experiments/plugin-abc-v1/runs/arm-a/r2/evidence/g02_baseline_measure.log",
            "experiments/plugin-abc-v1/runs/arm-a/r2/evidence/g02_candidate_measure.log"
          ]
        }
      ],
      "evidence_complete": true,
      "limitations": ["The mapping recipe reports generic gate counts, not placed timing or power."]
    },
    {
      "case_id": "g03",
      "source_sha256": "30162d495549647c477decd0b691b5e2dcb18b9b56edd3bd000851e511097998",
      "decision": "no_change",
      "scope_claim": "finding_only",
      "source_locations": ["experiments/plugin-abc-v1/cases/generated/g03_mixed_safe_add.sv:7"],
      "rationale": "Reassociation of only the independent sum output passed formal equivalence, while both versions mapped to the same 340-gate network (154 AND, 2 NOT, 92 OR, 92 XOR).",
      "candidates": [
        {
          "candidate_id": "g03_candidate_1",
          "path": "experiments/plugin-abc-v1/runs/arm-a/r2/candidates/g03/candidate_1.sv",
          "formal_status": "formal_passed",
          "measurement_status": "measured",
          "final_state": "synthesis_handles",
          "evidence_paths": [
            "experiments/plugin-abc-v1/runs/arm-a/r2/evidence/g03_formal.log",
            "experiments/plugin-abc-v1/runs/arm-a/r2/evidence/g03_baseline_measure.log",
            "experiments/plugin-abc-v1/runs/arm-a/r2/evidence/g03_candidate_measure.log"
          ]
        }
      ],
      "evidence_complete": true,
      "limitations": ["The finding covers the add expression only; the selection logic was preserved unchanged."]
    },
    {
      "case_id": "g04",
      "source_sha256": "d41c31a3112e798bd67ab057e52043949e3f0b0ed10526be7e62daaa74fa2dfc",
      "decision": "no_change",
      "scope_claim": "finding_only",
      "source_locations": ["experiments/plugin-abc-v1/cases/generated/g04_mixed_procedural_add.sv:10"],
      "rationale": "Balancing the non-bypass add passed formal equivalence, but baseline and candidate each mapped to 239 gates (86 AND, 16 MUX, 45 OR, 92 XOR), so the source rewrite has no measured benefit in this flow.",
      "candidates": [
        {
          "candidate_id": "g04_candidate_1",
          "path": "experiments/plugin-abc-v1/runs/arm-a/r2/candidates/g04/candidate_1.sv",
          "formal_status": "formal_passed",
          "measurement_status": "measured",
          "final_state": "synthesis_handles",
          "evidence_paths": [
            "experiments/plugin-abc-v1/runs/arm-a/r2/evidence/g04_formal.log",
            "experiments/plugin-abc-v1/runs/arm-a/r2/evidence/g04_baseline_measure.log",
            "experiments/plugin-abc-v1/runs/arm-a/r2/evidence/g04_candidate_measure.log"
          ]
        }
      ],
      "evidence_complete": true,
      "limitations": ["The finding covers the arithmetic branch only; generic mapping does not estimate routed timing or power."]
    },
    {
      "case_id": "g05",
      "source_sha256": "62594ad1604fbb46bf32eb1b875af6325effb07ca9f9357994a567172e6a0dac",
      "decision": "no_change",
      "scope_claim": "whole_case",
      "source_locations": ["experiments/plugin-abc-v1/cases/generated/g05_mux_common_logic.sv:6"],
      "rationale": "Factoring the common add operand to place the mux before one adder passed formal equivalence, but ABC produced the same 93-gate result for baseline and candidate (29 AND, 16 MUX, 17 OR, 31 XOR), demonstrating synthesis handling in the measured flow.",
      "candidates": [
        {
          "candidate_id": "g05_candidate_1",
          "path": "experiments/plugin-abc-v1/runs/arm-a/r2/candidates/g05/candidate_1.sv",
          "formal_status": "formal_passed",
          "measurement_status": "measured",
          "final_state": "synthesis_handles",
          "evidence_paths": [
            "experiments/plugin-abc-v1/runs/arm-a/r2/evidence/g05_formal.log",
            "experiments/plugin-abc-v1/runs/arm-a/r2/evidence/g05_baseline_measure.log",
            "experiments/plugin-abc-v1/runs/arm-a/r2/evidence/g05_candidate_measure.log"
          ]
        }
      ],
      "evidence_complete": true,
      "limitations": ["The mapping recipe reports generic gate counts, not placed timing or power."]
    },
    {
      "case_id": "g06",
      "source_sha256": "66994157674f3bfdecb558a82d23c677e36747ea6524cfb643254207141d4669",
      "decision": "inconclusive",
      "scope_claim": "finding_only",
      "source_locations": ["experiments/plugin-abc-v1/cases/generated/g06_priority_decode.sv:6"],
      "rationale": "The source is a deliberate highest-index-first priority chain. A tree or casez rewrite could change priority or X behavior, and no bounded candidate was proven and measured, so no change is recommended.",
      "candidates": [],
      "evidence_complete": false,
      "limitations": ["Static review only; no candidate, formal proof, or mapped comparison was run."]
    },
    {
      "case_id": "g07",
      "source_sha256": "fb0edeead88d4382e1ccb2d1fe79bc76dc62a7c6c6d7f57540c5a6033f7f93a2",
      "decision": "no_change",
      "scope_claim": "whole_case",
      "source_locations": ["experiments/plugin-abc-v1/cases/generated/g07_width_truncation.sv:5", "experiments/plugin-abc-v1/cases/generated/g07_width_truncation.sv:7"],
      "rationale": "The named 8-bit partial sum intentionally truncates carry before the later expression; reassociating across that boundary is not generally equivalent to a widened total, so no safe optimization was proposed.",
      "candidates": [],
      "evidence_complete": true,
      "limitations": ["No candidate was created because the apparent arithmetic rewrite crosses an explicit width boundary."]
    },
    {
      "case_id": "g08",
      "source_sha256": "b012fa81c56e0e2a101f605b9b8f00de337063c29d9217c8ffd020b767372d6d",
      "decision": "no_change",
      "scope_claim": "whole_case",
      "source_locations": ["experiments/plugin-abc-v1/cases/generated/g08_signed_chain.sv:5"],
      "rationale": "Fixed-width signed reassociation passed bit-vector formal equivalence, but both forms mapped to 221 gates (86 AND, 43 OR, 92 XOR); the measured synthesis flow eliminates the grouping difference.",
      "candidates": [
        {
          "candidate_id": "g08_candidate_1",
          "path": "experiments/plugin-abc-v1/runs/arm-a/r2/candidates/g08/candidate_1.sv",
          "formal_status": "formal_passed",
          "measurement_status": "measured",
          "final_state": "synthesis_handles",
          "evidence_paths": [
            "experiments/plugin-abc-v1/runs/arm-a/r2/evidence/g08_formal.log",
            "experiments/plugin-abc-v1/runs/arm-a/r2/evidence/g08_baseline_measure.log",
            "experiments/plugin-abc-v1/runs/arm-a/r2/evidence/g08_candidate_measure.log"
          ]
        }
      ],
      "evidence_complete": true,
      "limitations": ["Formal proof is two-state bit-vector equivalence; the mapping recipe does not estimate routed timing or power."]
    },
    {
      "case_id": "g09",
      "source_sha256": "c1bbfbc8ffc8ea0b18fdfa3ddaa621171e513d51a285aebde8181059ac7a1ff0",
      "decision": "no_change",
      "scope_claim": "whole_case",
      "source_locations": ["experiments/plugin-abc-v1/cases/generated/g09_already_balanced.sv:5"],
      "rationale": "The four-input modular sum is already expressed as a balanced two-level tree; no local RTL change offers a lower arithmetic depth.",
      "candidates": [],
      "evidence_complete": true,